{
  "$schema": "https://json-schema.org/draft/2020-12/schema",
  "$id": "https://biograph/schema/entity.schema.json",
  "title": "Entity",
  "description": "A node in the biographical graph: a person, place, organization, or named artifact (invention/patent/product/publication).",
  "type": "object",
  "additionalProperties": false,
  "required": ["id", "entity_type", "name"],
  "properties": {
    "id": {
      "type": "string",
      "pattern": "^[a-z][a-z0-9_]*$",
      "description": "Stable snake_case id, unique within entities.json."
    },
    "entity_type": {
      "type": "string",
      "enum": ["person", "place", "organization", "artifact"]
    },
    "name": { "type": "string" },
    "aliases": {
      "type": "array",
      "items": { "type": "string" },
      "description": "Other names/spellings this entity is referred to by in sources."
    },
    "summary": {
      "type": "string",
      "description": "One terse sentence -- a phrase an expert in the field could scan and immediately place this entity, not a paragraph. Static facts only, NOT events — no dates, no 'in 1974...' clauses."
    },
    "subtype": {
      "type": "string",
      "description": "Free-text refinement, e.g. person: 'researcher'; place: 'city'/'country'/'facility'; organization: 'company'/'university'/'lab'; artifact: 'invention'/'patent'/'product'/'publication'/'award'."
    },
    "attributes": {
      "type": "object",
      "description": "Optional structured extras (e.g. { \"country\": \"Finland\" } for a place).",
      "additionalProperties": true
    },
    "portrait": {
      "type": "object",
      "description": "A verified photo, only for entity_type 'person'. Never hand-picked from an image search — see schema/README.md § Portraits for the required verification steps before adding one.",
      "additionalProperties": false,
      "required": ["image_url", "source_url", "license", "confidence"],
      "properties": {
        "image_url": { "type": "string", "description": "Direct, hotlinkable image URL (e.g. a Wikimedia Commons Special:FilePath link). Loaded live by the viewer's browser at render time — never embedded as a data URI." },
        "source_url": { "type": "string", "description": "Page a reader can open to verify the photo and its licensing (e.g. the Commons file page)." },
        "wikidata_qid": { "type": "string", "description": "Wikidata item id the photo and identity claims were verified against, if applicable." },
        "license": { "type": "string", "description": "Short license name, e.g. 'CC BY-SA 4.0'." },
        "license_url": { "type": "string" },
        "artist": { "type": "string" },
        "confidence": {
          "type": "string",
          "enum": ["birth_year_verified", "description_verified", "unverified"],
          "description": "How identity was confirmed: 'birth_year_verified' = the candidate's Wikidata birth date matches a birth event already in this subject's events.json; 'description_verified' = no independent date to check, but the Wikidata description/occupation is specific enough to match this entity's role in the source (e.g. exact nationality + profession + era); 'unverified' must not be used to add a portrait — treat it as 'no match' instead."
        }
      }
    }
  }
}
