[
  {
    "aliases": [
      "E. D. Hughes",
      "E.D. Hughes",
      "Hughes"
    ],
    "entity_type": "person",
    "id": "edward_david_hughes",
    "name": "Edward David Hughes",
    "subtype": "researcher",
    "summary": "British physical organic chemist known for SN1 and SN2 reaction mechanisms."
  },
  {
    "aliases": [
      "C.K. Ingold",
      "Ingold"
    ],
    "entity_type": "person",
    "id": "christopher_k_ingold",
    "name": "Christopher K. Ingold",
    "subtype": "researcher",
    "summary": "British chemist who developed the electronic theory of organic reaction mechanisms."
  },
  {
    "aliases": [
      "Whitmore"
    ],
    "entity_type": "person",
    "id": "frank_c_whitmore",
    "name": "Frank C. Whitmore",
    "subtype": "researcher",
    "summary": "American organic chemist involved in debates over intramolecular rearrangement mechanisms."
  },
  {
    "aliases": [
      "E.S. Wallis",
      "Wallis"
    ],
    "entity_type": "person",
    "id": "everett_s_wallis",
    "name": "Everett S. Wallis",
    "subtype": "researcher",
    "summary": "American chemist who proposed the term carbanion and studied molecular rearrangements."
  },
  {
    "aliases": [
      "Watson"
    ],
    "entity_type": "person",
    "id": "herbert_b_watson",
    "name": "Herbert B. Watson",
    "subtype": "researcher",
    "summary": "British chemist and master of kinetic analysis who supervised Hughes' Ph.D."
  },
  {
    "aliases": [
      "Kon"
    ],
    "entity_type": "person",
    "id": "george_a_r_kon",
    "name": "George A. R. Kon",
    "subtype": "researcher",
    "summary": "British chemist and reporter for the homocyclic division of Annual Reports."
  },
  {
    "aliases": [
      "University College",
      "UCL"
    ],
    "entity_type": "organization",
    "id": "university_college_london",
    "name": "University College, London",
    "subtype": "university",
    "summary": "London university where Ingold and Hughes worked in the 1930s."
  },
  {
    "aliases": [],
    "entity_type": "organization",
    "id": "university_of_wales",
    "name": "University of Wales",
    "subtype": "university",
    "summary": "Welsh university where Hughes received his Ph.D."
  },
  {
    "aliases": [
      "Princeton"
    ],
    "entity_type": "organization",
    "id": "princeton_university",
    "name": "Princeton University",
    "subtype": "university",
    "summary": "American university where Everett S. Wallis spent his career."
  },
  {
    "aliases": [],
    "entity_type": "organization",
    "id": "imperial_college",
    "name": "Imperial College",
    "subtype": "university",
    "summary": "London institution where Ingold was a student and junior staff member."
  },
  {
    "aliases": [],
    "entity_type": "organization",
    "id": "leeds_university",
    "name": "Leeds University",
    "subtype": "university",
    "summary": "University where Ingold worked before moving to University College London."
  },
  {
    "aliases": [
      "Bangor"
    ],
    "entity_type": "organization",
    "id": "university_college_bangor",
    "name": "University College, Bangor",
    "subtype": "university",
    "summary": "Welsh university where Herbert B. Watson was head of department."
  },
  {
    "aliases": [
      "JACS",
      "Journal of the American Chemical So- ciety"
    ],
    "entity_type": "artifact",
    "id": "journal_of_the_american_chemical_society",
    "name": "Journal of the American Chemical Society",
    "subtype": "publication",
    "summary": "American chemistry journal where Hughes published his 1935 paper."
  },
  {
    "aliases": [],
    "entity_type": "artifact",
    "id": "journal_of_the_chemical_society",
    "name": "Journal of the Chemical Society",
    "subtype": "publication",
    "summary": "British chemistry journal where Whitmore and Flemming published in 1934."
  },
  {
    "aliases": [
      "Annual Reports"
    ],
    "entity_type": "artifact",
    "id": "annual_reports_on_the_progress_of_chemistry",
    "name": "Annual Reports on the Progress of Chemistry",
    "subtype": "publication",
    "summary": "Publication series where Kon commented on Whitmore and Wallis' work."
  },
  {
    "aliases": [],
    "entity_type": "artifact",
    "id": "hydrolysis_of_secondary_and_tertiary_halides",
    "name": "Hydrolysis of Secondary and Tertiary Halides",
    "subtype": "publication",
    "summary": "1935 paper by Hughes published in the Journal of the American Chemical Society."
  }
]