[
  {
    "aliases": [
      "Wernher von Braun"
    ],
    "entity_type": "person",
    "id": "wernher_von_braun",
    "name": "Wernher Magnus Maximilian Freiherr von Braun",
    "subtype": "researcher",
    "summary": "German-American designer of rocket and space technology and founder of the US space program.",
    "portrait": {
      "image_url": "https://commons.wikimedia.org/wiki/Special:FilePath/Wernher%20von%20Braun.jpg?width=200",
      "source_url": "https://commons.wikimedia.org/wiki/File:Wernher_von_Braun.jpg",
      "wikidata_qid": "Q57384",
      "license": "Public domain",
      "license_url": "",
      "artist": "NASA/MSFC",
      "confidence": "birth_year_verified"
    }
  },
  {
    "aliases": [],
    "entity_type": "person",
    "id": "magnus_von_braun",
    "name": "Magnus von Braun",
    "subtype": "person",
    "summary": "Father of Wernher von Braun and Minister of Food and Agriculture in the Weimar Republic."
  },
  {
    "aliases": [],
    "entity_type": "person",
    "id": "emmy_von_quistorp",
    "name": "Emmy von Quistorp",
    "subtype": "person",
    "summary": "Mother of Wernher von Braun with royal ancestry."
  },
  {
    "aliases": [
      "H. Oberth"
    ],
    "entity_type": "person",
    "id": "hermann_oberth",
    "name": "Hermann Oberth",
    "subtype": "researcher",
    "summary": "German pioneer of rocket science and mentor to Wernher von Braun."
  },
  {
    "aliases": [
      "W. Dornberger"
    ],
    "entity_type": "person",
    "id": "walter_dornberger",
    "name": "Walter Dornberger",
    "subtype": "person",
    "summary": "Military and administrative Head of the German Peenemünde test site."
  },
  {
    "aliases": [],
    "entity_type": "person",
    "id": "erich_schumann",
    "name": "Erich Schumann",
    "subtype": "researcher",
    "summary": "German physicist and supervisor of Wernher von Braun's doctoral thesis."
  },
  {
    "aliases": [
      "N. Armstrong"
    ],
    "entity_type": "person",
    "id": "neil_armstrong",
    "name": "Neil Armstrong",
    "subtype": "person",
    "summary": "American astronaut who first stepped on the surface of the Moon."
  },
  {
    "aliases": [],
    "entity_type": "person",
    "id": "john_f_kennedy",
    "name": "John F. Kennedy",
    "subtype": "person",
    "summary": "US President who initiated the Lunar Program."
  },
  {
    "aliases": [
      "Berlin Technical University"
    ],
    "entity_type": "organization",
    "id": "berlin_higher_technical_school",
    "name": "Berlin Higher Technical School",
    "subtype": "university",
    "summary": "University where Wernher von Braun studied starting in 1930."
  },
  {
    "aliases": [],
    "entity_type": "organization",
    "id": "friedrich_wilhelm_berlin_university",
    "name": "Friedrich Wilhelm Berlin University",
    "subtype": "university",
    "summary": "University where Wernher von Braun defended his Doctoral Thesis."
  },
  {
    "aliases": [
      "Peenemünde test site"
    ],
    "entity_type": "organization",
    "id": "peenemunde_rocket_center",
    "name": "Peenemünde Rocket Center",
    "subtype": "lab",
    "summary": "German rocket center and test site built in 1937 on the island Usedom."
  },
  {
    "aliases": [
      "American the army"
    ],
    "entity_type": "organization",
    "id": "us_army",
    "name": "US Army",
    "subtype": "organization",
    "summary": "Military organization Wernher von Braun surrendered to and worked for."
  },
  {
    "aliases": [
      "NASA"
    ],
    "entity_type": "organization",
    "id": "nasa",
    "name": "National Aeronautics and Space Administration",
    "subtype": "organization",
    "summary": "US government agency Wernher von Braun served as a designer."
  },
  {
    "aliases": [],
    "entity_type": "organization",
    "id": "marshall_space_flight_center",
    "name": "Marshall Space Flight Center",
    "subtype": "lab",
    "summary": "US Space Center in Huntsville, Alabama, where Wernher von Braun was the first Director."
  },
  {
    "aliases": [],
    "entity_type": "organization",
    "id": "fairchild_space_industries",
    "name": "Fairchild Space Industries",
    "subtype": "company",
    "summary": "Company where Wernher von Braun worked as Vice-President after NASA."
  },
  {
    "aliases": [
      "Wyrzysk"
    ],
    "attributes": {
      "country": "German Empire",
      "modern_country": "Poland"
    },
    "entity_type": "place",
    "id": "wirsitz",
    "name": "Wirsitz",
    "subtype": "city",
    "summary": "City in the province of Posen, German Empire, where Wernher von Braun was born."
  },
  {
    "aliases": [],
    "attributes": {
      "country": "United States",
      "region": "Texas",
      "lat": 31.82988,
      "lng": -106.36964,
      "wikidata_qid": "Q707110",
      "geocode_basis": "country"
    },
    "entity_type": "place",
    "id": "fort_bliss",
    "name": "Fort Bliss",
    "subtype": "facility",
    "summary": "US Army base in Texas where German rocket scientists were placed in 1945."
  },
  {
    "aliases": [],
    "attributes": {
      "country": "United States",
      "region": "Alabama"
    },
    "entity_type": "organization",
    "id": "redstone_arsenal",
    "name": "Redstone Arsenal",
    "subtype": "lab",
    "summary": "US facility in Huntsville, Alabama, where Wernher von Braun worked from 1950."
  },
  {
    "aliases": [],
    "attributes": {
      "country": "United States",
      "region": "Florida",
      "lat": 28.45556,
      "lng": -80.52778,
      "wikidata_qid": "Q193401",
      "geocode_basis": "country"
    },
    "entity_type": "place",
    "id": "cape_canaveral",
    "name": "Cape Canaveral",
    "subtype": "facility",
    "summary": "Spaceport in Florida where Wernher von Braun led the space center."
  },
  {
    "aliases": [],
    "attributes": {
      "country": "United States",
      "region": "Virginia",
      "lat": 38.80472,
      "lng": -77.04722,
      "wikidata_qid": "Q88",
      "geocode_basis": "country"
    },
    "entity_type": "place",
    "id": "alexandria_virginia",
    "name": "Alexandria",
    "subtype": "city",
    "summary": "City in Virginia where Wernher von Braun died and was buried."
  },
  {
    "aliases": [],
    "attributes": {
      "country": "United States",
      "region": "Virginia",
      "lat": 38.8175,
      "lng": -77.0736,
      "wikidata_qid": "Q6099858",
      "geocode_basis": "country"
    },
    "entity_type": "place",
    "id": "ivy_hill_cemetery",
    "name": "Ivy Hill Cemetery",
    "subtype": "facility",
    "summary": "Cemetery in Alexandria, Virginia, where Wernher von Braun was buried."
  },
  {
    "aliases": [
      "A-4",
      "combat ballistic missile V-2"
    ],
    "entity_type": "artifact",
    "id": "v2_rocket",
    "name": "V-2 rocket",
    "subtype": "invention",
    "summary": "German single-stage ballistic missile with LRE created in 1944."
  },
  {
    "aliases": [
      "PGM-11",
      "Redstone combat ballistic missile"
    ],
    "entity_type": "artifact",
    "id": "redstone_missile",
    "name": "Redstone missile",
    "subtype": "invention",
    "summary": "American medium-range ballistic missile created in 1952."
  },
  {
    "aliases": [
      "Explorer 1",
      "first artificial satellite of the USA"
    ],
    "entity_type": "artifact",
    "id": "explorer_1",
    "name": "Explorer-1",
    "subtype": "product",
    "summary": "First artificial satellite of the USA launched in 1958."
  },
  {
    "aliases": [
      "Saturn-5",
      "Saturn-V launch vehicle"
    ],
    "entity_type": "artifact",
    "id": "saturn_v",
    "name": "Saturn-V",
    "subtype": "invention",
    "summary": "Powerful American launch vehicle created in 1969 for manned flights to the Moon."
  },
  {
    "aliases": [
      "American Apollo-11 spacecraft"
    ],
    "entity_type": "artifact",
    "id": "apollo_11",
    "name": "Apollo-11",
    "subtype": "product",
    "summary": "Spacecraft that carried out the first landing on the lunar surface in 1969."
  }
]
