[
  {
    "aliases": [
      "K. G. Wilson",
      "Ken Wilson",
      "Kenneth G. Wilson"
    ],
    "entity_type": "person",
    "id": "kenneth_g_wilson",
    "name": "Kenneth Geddes Wilson",
    "subtype": "researcher",
    "summary": "American theoretical physicist known for renormalization group and lattice gauge theory.",
    "portrait": {
      "image_url": "https://commons.wikimedia.org/wiki/Special:FilePath/Kenneth%20G.%20Wilson.121.png?width=200",
      "source_url": "https://commons.wikimedia.org/wiki/File:Kenneth_G._Wilson.121.png",
      "wikidata_qid": "Q193503",
      "license": "CC BY-SA 4.0",
      "license_url": "https://creativecommons.org/licenses/by-sa/4.0",
      "artist": "The Nobel Prize",
      "confidence": "birth_year_verified"
    }
  },
  {
    "aliases": [
      "Andreas Kronfeld"
    ],
    "entity_type": "person",
    "id": "andreas_s_kronfeld",
    "name": "Andreas S. Kronfeld",
    "subtype": "researcher",
    "summary": "Physicist at Fermi National Accelerator Laboratory and author of this retrospective."
  },
  {
    "aliases": [
      "Wilson's father"
    ],
    "entity_type": "person",
    "id": "e_bright_wilson",
    "name": "E. Bright Wilson",
    "subtype": "researcher",
    "summary": "Eminent chemist and co-author with Linus Pauling."
  },
  {
    "aliases": [
      "Emily (née Buckingham) Wilson"
    ],
    "entity_type": "person",
    "id": "emily_wilson",
    "name": "Emily Wilson",
    "subtype": "person",
    "summary": "Mother of Kenneth Geddes Wilson."
  },
  {
    "aliases": [
      "Gell-Mann"
    ],
    "entity_type": "person",
    "id": "murray_gell_mann",
    "name": "Murray Gell-Mann",
    "subtype": "researcher",
    "summary": "Physicist who supervised Kenneth Wilson's Ph.D. at CalTech."
  },
  {
    "aliases": [
      "Fisher",
      "M. E. Fisher"
    ],
    "entity_type": "person",
    "id": "michael_fisher",
    "name": "Michael Fisher",
    "subtype": "researcher",
    "summary": "Physicist who collaborated with Wilson on critical exponents."
  },
  {
    "aliases": [
      "Kadanoff",
      "L. P. Kadanoff"
    ],
    "entity_type": "person",
    "id": "leo_kadanoff",
    "name": "Leo Kadanoff",
    "subtype": "researcher",
    "summary": "Physicist known for block spin picture and Wolf Prize co-recipient."
  },
  {
    "aliases": [
      "Lepage",
      "G. P. Lepage"
    ],
    "entity_type": "person",
    "id": "peter_lepage",
    "name": "Peter Lepage",
    "subtype": "researcher",
    "summary": "Physicist who collaborated with Wilson on lattice gauge theory algorithms."
  },
  {
    "aliases": [
      "Bethe"
    ],
    "entity_type": "person",
    "id": "hans_bethe",
    "name": "Hans Bethe",
    "subtype": "researcher",
    "summary": "Physicist and colleague at Cornell University."
  },
  {
    "aliases": [
      "Cornell"
    ],
    "entity_type": "organization",
    "id": "cornell_university",
    "name": "Cornell University",
    "subtype": "university",
    "summary": "University in Ithaca, New York, where Wilson was a faculty member."
  },
  {
    "aliases": [
      "Harvard"
    ],
    "entity_type": "organization",
    "id": "harvard_university",
    "name": "Harvard University",
    "subtype": "university",
    "summary": "University where Wilson majored in mathematics and was a Society of Fellows member."
  },
  {
    "aliases": [
      "CalTech"
    ],
    "entity_type": "organization",
    "id": "california_institute_of_technology",
    "name": "California Institute of Technology",
    "subtype": "university",
    "summary": "Institution where Wilson obtained his Ph.D."
  },
  {
    "aliases": [
      "OSU"
    ],
    "entity_type": "organization",
    "id": "ohio_state_university",
    "name": "Ohio State University",
    "subtype": "university",
    "summary": "University where Wilson moved in 1988."
  },
  {
    "aliases": [
      "Fermilab"
    ],
    "entity_type": "organization",
    "id": "fermi_national_accelerator_laboratory",
    "name": "Fermi National Accelerator Laboratory",
    "subtype": "lab",
    "summary": "National laboratory where the author Andreas Kronfeld works."
  },
  {
    "aliases": [],
    "entity_type": "organization",
    "id": "george_school",
    "name": "George School",
    "subtype": "school",
    "summary": "Quaker boarding school in eastern Pennsylvania where Wilson graduated."
  },
  {
    "aliases": [],
    "entity_type": "organization",
    "id": "society_of_fellows",
    "name": "Society of Fellows",
    "subtype": "organization",
    "summary": "Harvard organization where Wilson was a member from 1959 to 1962."
  },
  {
    "aliases": [],
    "entity_type": "organization",
    "id": "cern",
    "name": "CERN",
    "subtype": "lab",
    "summary": "European physics laboratory visited by Wilson before Cornell."
  },
  {
    "aliases": [
      "Waltham"
    ],
    "entity_type": "place",
    "id": "waltham_massachusetts",
    "name": "Waltham, Massachusetts",
    "subtype": "city",
    "summary": "City in Massachusetts where Wilson was born.",
    "attributes": {
      "lat": 42.3806,
      "lng": -71.23501,
      "wikidata_qid": "Q49190",
      "geocode_basis": "most_linked"
    }
  },
  {
    "aliases": [
      "Saco"
    ],
    "entity_type": "place",
    "id": "saco_maine",
    "name": "Saco, Maine",
    "subtype": "city",
    "summary": "City in Maine where Wilson died.",
    "attributes": {
      "lat": 43.51056,
      "lng": -70.445,
      "wikidata_qid": "Q1001891",
      "geocode_basis": "most_linked"
    }
  },
  {
    "aliases": [
      "Nobel Prize"
    ],
    "entity_type": "artifact",
    "id": "nobel_prize_physics",
    "name": "Nobel Prize in Physics",
    "subtype": "award",
    "summary": "Prestigious award received by Wilson for critical phenomena theory."
  },
  {
    "aliases": [],
    "entity_type": "artifact",
    "id": "wolf_prize",
    "name": "Wolf Prize",
    "subtype": "award",
    "summary": "Award shared by Wilson, Fisher, and Kadanoff in 1980."
  },
  {
    "aliases": [],
    "entity_type": "artifact",
    "id": "wilson_loop",
    "name": "Wilson loop",
    "subtype": "invention",
    "summary": "Theoretical tool in gauge field theory named after Wilson."
  },
  {
    "aliases": [
      "Ken Wilson Lattice Award"
    ],
    "entity_type": "artifact",
    "id": "kenneth_g_wilson_award",
    "name": "Kenneth G. Wilson Award for Excellence in Lattice Field Theory",
    "subtype": "award",
    "summary": "Award introduced in 2011 to commemorate Wilson's contributions."
  }
]
